{
  "$schema": "https://json-schema.org/draft/2020-12/schema",
  "$id": "current-base-installed-execution-v1",
  "title": "Current Base installed execution verifier contract",
  "type": "object",
  "additionalProperties": false,
  "required": ["schemaId", "manifestType", "verifierId", "invocation", "executionPolicy", "isolationPolicy", "requiredObservations", "evidenceContract", "exitSemantics"],
  "properties": {
    "schemaId": {"const": "current-base-installed-execution-v1"},
    "manifestType": {"const": "current-base-installed-execution-verifier"},
    "verifierId": {"const": "current-base-installed-execution-v1"},
    "invocation": {
      "type": "object", "additionalProperties": false,
      "required": ["toolArtifactRole", "mainClass", "arguments"],
      "properties": {
        "toolArtifactRole": {"const": "server-runtime"},
        "mainClass": {"const": "com.openrsc.server.database.CurrentBaseInstalledExecutionVerifier"},
        "arguments": {"type": "array", "minItems": 14, "maxItems": 14, "prefixItems": [
          {"const": "--contract"}, {"const": "--composition-identity"}, {"const": "--runtime-profile"},
          {"const": "--installed-server-root"}, {"const": "--installed-client-root"}, {"const": "--server-config"},
          {"const": "--server-profile"}, {"const": "--client-profile"}, {"const": "--map-package"},
          {"const": "--state-db"}, {"const": "--workspace"}, {"const": "--server-port"},
          {"const": "--websocket-port"}, {"const": "--evidence"}
        ], "items": false}
      }
    },
    "executionPolicy": {
      "type": "object", "additionalProperties": false,
      "required": ["engine", "endpoint", "launchCount", "serverReadyTimeoutSeconds", "clientEvidenceTimeoutSeconds", "shutdownTimeoutSeconds", "maximumLogBytesPerProcess", "maximumMapManifestBytes", "maximumSourceFilesPerRoot", "maximumSourceBytesPerRoot", "graphicalClientPrerequisite", "mapSpawnSelection"],
      "properties": {
        "engine": {"const": "sqlite"}, "endpoint": {"const": "127.0.0.1"}, "launchCount": {"const": 2},
        "serverReadyTimeoutSeconds": {"const": 60}, "clientEvidenceTimeoutSeconds": {"const": 90},
        "shutdownTimeoutSeconds": {"const": 20}, "maximumLogBytesPerProcess": {"const": 1048576},
        "maximumMapManifestBytes": {"const": 16777216},
        "maximumSourceFilesPerRoot": {"const": 20000}, "maximumSourceBytesPerRoot": {"const": 1073741824},
        "graphicalClientPrerequisite": {"const": "java-awt-non-headless"},
        "mapSpawnSelection": {"const": "global-level-zero-sector-center-coverage-only"}
      }
    },
    "isolationPolicy": {
      "type": "object", "additionalProperties": false,
      "required": ["workspace", "sourceMutation", "runtimeRoots", "state", "map", "account", "credential", "workspacePermissions", "network", "processes"],
      "properties": {
        "workspace": {"const": "new-provider-owned-disposable-directory"},
        "sourceMutation": {"const": "forbidden-hash-before-and-after"},
        "runtimeRoots": {"const": "copied-under-workspace"}, "state": {"const": "copied-sqlite-database-outside-runtime-roots"},
        "map": {"const": "copied-package-outside-runtime-roots"},
        "account": {"const": "generated-disposable-account-only"},
        "credential": {"const": "generated-inside-workspace-delete-always"},
        "workspacePermissions": {"const": "owner-only-0700-and-state-0600"},
        "network": {"const": "literal-ipv4-loopback-only"}, "processes": {"const": "bounded-and-terminated-always"}
      }
    },
    "requiredObservations": {"type": "array", "minItems": 7, "maxItems": 7, "uniqueItems": true, "items": {"enum": ["six-field-composition-handshake", "successful-normal-login", "canonical-installed-map", "representative-disposable-state", "normal-logout", "second-launch-restart-persistence", "advanced-configuration-excluded"]}},
    "evidenceContract": {"type": "object", "additionalProperties": false, "required": ["schemaId", "outputPolicy", "credentialDisclosure", "sourcePathDisclosure"], "properties": {
      "schemaId": {"const": "current-base-installed-execution-evidence-v1"}, "outputPolicy": {"const": "create-new-regular-file"},
      "credentialDisclosure": {"const": "forbidden"}, "sourcePathDisclosure": {"const": "forbidden"}
    }},
    "exitSemantics": {"type": "object", "additionalProperties": false, "required": ["verified", "refused"], "properties": {"verified": {"const": 0}, "refused": {"const": 2}}}
  }
}
